[
  {
    "source_doc": "Perlis_master_plan.pdf",
    "source_page": 11,
    "state": "PLS",
    "commitment_type": "visitor_arrivals",
    "target_value": 6500000,
    "target_unit": "tourist arrivals",
    "target_year": 2030,
    "baseline_value": 4100000,
    "baseline_year": 2018,
    "sustainability_dimension": "economic",
    "verbatim_quote": "6,500,000 TOURIST ARRIVALS 2018 Milestone: 4,100,000 tourist arrivals",
    "confidence": "high"
  },
  {
    "source_doc": "Perlis_master_plan.pdf",
    "source_page": 11,
    "state": "PLS",
    "commitment_type": "tourism_receipts",
    "target_value": 8000,
    "target_unit": "RM million GDP",
    "target_year": 2030,
    "baseline_value": 5884,
    "baseline_year": 2018,
    "sustainability_dimension": "economic",
    "verbatim_quote": "GDP WORTH RM 8,000 MILLION (AVERAGE ANNUAL GROWTH RATE OF 2.75%) 2018 Milestone: Worth RM 5,884 million",
    "confidence": "high"
  },
  {
    "source_doc": "Perlis_master_plan.pdf",
    "source_page": 11,
    "state": "PLS",
    "commitment_type": "other",
    "target_value": 4,
    "target_unit": "international standard tourism products",
    "target_year": 2030,
    "baseline_value": 0,
    "baseline_year": 2018,
    "sustainability_dimension": "economic",
    "verbatim_quote": "4 INTERNATIONAL STANDARD TOURISM PRODUCTS & 2 INTERNATIONAL STANDARD TOURISM EVENTS",
    "confidence": "high"
  },
  {
    "source_doc": "Perlis_master_plan.pdf",
    "source_page": 11,
    "state": "PLS",
    "commitment_type": "employment",
    "target_value": 100000,
    "target_unit": "service sector workforce",
    "target_year": 2030,
    "baseline_value": 74400,
    "baseline_year": 2018,
    "sustainability_dimension": "social",
    "verbatim_quote": "WORKFORCE PARTICIPATION IN THE SERVICE SECTOR ATTAINED 100,000 EMPLOYMENT 2018 Milestone: 74,400",
    "confidence": "high"
  },
  {
    "source_doc": "Perlis_master_plan.pdf",
    "source_page": 11,
    "state": "PLS",
    "commitment_type": "hotel_rooms",
    "target_value": 45,
    "target_unit": "percent accommodation occupancy rate",
    "target_year": 2030,
    "baseline_value": 31,
    "baseline_year": 2018,
    "sustainability_dimension": "economic",
    "verbatim_quote": "ACCOMMODATION OCCUPANCY RATE OF 45% 2018 Milestone: Accommodation occupancy rate of 31%",
    "confidence": "high"
  },
  {
    "source_doc": "Perlis_master_plan.pdf",
    "source_page": 11,
    "state": "PLS",
    "commitment_type": "other",
    "target_value": 100,
    "target_unit": "percent tourism entrepreneurs registered online",
    "target_year": 2030,
    "baseline_value": 0,
    "baseline_year": 2018,
    "sustainability_dimension": "economic",
    "verbatim_quote": "100% OF TOURISM ENTREPRENEURS REGISTERED WITH THE OFFICIAL TOURISM WEBSITE",
    "confidence": "medium"
  }
]
