[
  {
    "source_doc": "Full_Document_RMK13.pdf",
    "source_page": 63,
    "state": "national",
    "commitment_type": "other",
    "target_value": 45,
    "target_unit": "percent reduction",
    "target_year": 2030,
    "baseline_value": null,
    "baseline_year": 2005,
    "sustainability_dimension": "environmental",
    "verbatim_quote": "Malaysia is committed to achieve the target of 45% reduction in GHG emissions intensity to GDP in 2030 based on the emissions intensity in 2005",
    "confidence": "high"
  },
  {
    "source_doc": "Full_Document_RMK13.pdf",
    "source_page": 32,
    "state": "national",
    "commitment_type": "other",
    "target_value": 5.2,
    "target_unit": "percent per annum",
    "target_year": 2030,
    "baseline_value": null,
    "baseline_year": null,
    "sustainability_dimension": "economic",
    "verbatim_quote": "growth of the services sector, which is targeted at 5.2% per annum during the Thirteenth Plan period",
    "confidence": "high"
  },
  {
    "source_doc": "Full_Document_RMK13.pdf",
    "source_page": 82,
    "state": "national",
    "commitment_type": "other",
    "target_value": 40,
    "target_unit": "percent modal share",
    "target_year": 2030,
    "baseline_value": null,
    "baseline_year": null,
    "sustainability_dimension": "environmental",
    "verbatim_quote": "continued towards achieving the target of 40% modal share in 2030",
    "confidence": "high"
  },
  {
    "source_doc": "Full_Document_RMK13.pdf",
    "source_page": 36,
    "state": "national",
    "commitment_type": "employment",
    "target_value": 40,
    "target_unit": "percent of GDP",
    "target_year": 2030,
    "baseline_value": null,
    "baseline_year": null,
    "sustainability_dimension": "social",
    "verbatim_quote": "increase the share of compensation of employees to 40% to GDP by 2030",
    "confidence": "high"
  },
  {
    "source_doc": "Full_Document_RMK13.pdf",
    "source_page": 36,
    "state": "national",
    "commitment_type": "employment",
    "target_value": 60,
    "target_unit": "percent",
    "target_year": 2030,
    "baseline_value": null,
    "baseline_year": null,
    "sustainability_dimension": "social",
    "verbatim_quote": "60% of the female labour force participation rate, 10 years after the introduction of the Ekonomi MADANI",
    "confidence": "high"
  },
  {
    "source_doc": "Full_Document_RMK13.pdf",
    "source_page": 31,
    "state": "national",
    "commitment_type": "other",
    "target_value": 6,
    "target_unit": "percent per annum",
    "target_year": 2030,
    "baseline_value": null,
    "baseline_year": null,
    "sustainability_dimension": "economic",
    "verbatim_quote": "increase private investment growth at 6% per annum, with an average value of RM417.9 billion per year",
    "confidence": "high"
  },
  {
    "source_doc": "Full_Document_RMK13.pdf",
    "source_page": 32,
    "state": "national",
    "commitment_type": "employment",
    "target_value": 3.6,
    "target_unit": "percent per annum",
    "target_year": 2030,
    "baseline_value": null,
    "baseline_year": null,
    "sustainability_dimension": "economic",
    "verbatim_quote": "increase the average growth of labour productivity at 3.6% per annum during the Thirteenth Plan period",
    "confidence": "high"
  },
  {
    "source_doc": "Full_Document_RMK13.pdf",
    "source_page": 56,
    "state": "national",
    "commitment_type": "employment",
    "target_value": 700000,
    "target_unit": "skilled workers",
    "target_year": 2030,
    "baseline_value": null,
    "baseline_year": null,
    "sustainability_dimension": "social",
    "verbatim_quote": "meet the needs of 700,000 skilled workers by 2030 in the manufacturing sector and manufacturing-related services subsector",
    "confidence": "medium"
  },
  {
    "source_doc": "Full_Document_RMK13.pdf",
    "source_page": 43,
    "state": "national",
    "commitment_type": "other",
    "target_value": 3,
    "target_unit": "percent of GDP",
    "target_year": 2030,
    "baseline_value": null,
    "baseline_year": null,
    "sustainability_dimension": "economic",
    "verbatim_quote": "reduce the fiscal deficit to be below 3% and ensure that the debt level will not exceed 60% to GDP",
    "confidence": "high"
  },
  {
    "source_doc": "Full_Document_RMK13.pdf",
    "source_page": 150,
    "state": "national",
    "commitment_type": "other",
    "target_value": 500000,
    "target_unit": "units",
    "target_year": 2030,
    "baseline_value": 179769,
    "baseline_year": 2025,
    "sustainability_dimension": "social",
    "verbatim_quote": "Number of affordable houses constructed...500,000 units",
    "confidence": "high"
  },
  {
    "source_doc": "Full_Document_RMK13.pdf",
    "source_page": 85,
    "state": "national",
    "commitment_type": "other",
    "target_value": 1000,
    "target_unit": "accredited social enterprises",
    "target_year": 2030,
    "baseline_value": 382,
    "baseline_year": 2024,
    "sustainability_dimension": "social",
    "verbatim_quote": "Number of accredited social enterprises...382 (2024)...1,000 (2030)",
    "confidence": "high"
  },
  {
    "source_doc": "Full_Document_RMK13.pdf",
    "source_page": 97,
    "state": "national",
    "commitment_type": "employment",
    "target_value": 1700,
    "target_unit": "RM per month",
    "target_year": 2025,
    "baseline_value": 1500,
    "baseline_year": 2022,
    "sustainability_dimension": "social",
    "verbatim_quote": "the second revision involved the increase to RM1,700 effective February 2025",
    "confidence": "high"
  }
]
