[
  {
    "source_doc": "Johor_master_plan.pdf",
    "source_page": 119,
    "state": "JOH",
    "commitment_type": "other",
    "target_value": 281707,
    "target_unit": "RM million GDP",
    "target_year": 2030,
    "baseline_value": 106709,
    "baseline_year": 2015,
    "sustainability_dimension": "economic",
    "verbatim_quote": "KDNK Negeri daripada RM 106,709 juta (2015) kepada RM 281,707 juta (2030)",
    "confidence": "high"
  },
  {
    "source_doc": "Johor_master_plan.pdf",
    "source_page": 119,
    "state": "JOH",
    "commitment_type": "other",
    "target_value": 6.5,
    "target_unit": "percent per annum",
    "target_year": 2030,
    "baseline_value": 5.9,
    "baseline_year": 2015,
    "sustainability_dimension": "economic",
    "verbatim_quote": "Kadar pertumbuhan ekonomi/KDNK Negeri 5.9% (2015) Sasaran 6.5% (2030)",
    "confidence": "high"
  },
  {
    "source_doc": "Johor_master_plan.pdf",
    "source_page": 119,
    "state": "JOH",
    "commitment_type": "other",
    "target_value": 45301,
    "target_unit": "RM per capita",
    "target_year": 2030,
    "baseline_value": 29558,
    "baseline_year": 2015,
    "sustainability_dimension": "economic",
    "verbatim_quote": "KDNK per kapita negeri RM 29,558 (2015) Sasaran RM 45,301 (2030)",
    "confidence": "high"
  },
  {
    "source_doc": "Johor_master_plan.pdf",
    "source_page": 119,
    "state": "JOH",
    "commitment_type": "other",
    "target_value": 13000,
    "target_unit": "RM per month household income",
    "target_year": 2030,
    "baseline_value": 6981,
    "baseline_year": 2015,
    "sustainability_dimension": "social",
    "verbatim_quote": "Pendapatan isi rumah purata RM 6,981 (2015) Sasaran RM 13,000 (2030)",
    "confidence": "high"
  },
  {
    "source_doc": "Johor_master_plan.pdf",
    "source_page": 124,
    "state": "JOH",
    "commitment_type": "other",
    "target_value": 6.21,
    "target_unit": "million population",
    "target_year": 2030,
    "baseline_value": 3.61,
    "baseline_year": 2015,
    "sustainability_dimension": "social",
    "verbatim_quote": "sasaran penduduk daripada 3.61 juta orang (2015) kepada 6.21 juta orang (2030)",
    "confidence": "high"
  },
  {
    "source_doc": "Johor_master_plan.pdf",
    "source_page": 124,
    "state": "JOH",
    "commitment_type": "employment",
    "target_value": 0.75,
    "target_unit": "labour force participation rate",
    "target_year": 2030,
    "baseline_value": 0.64,
    "baseline_year": 2015,
    "sustainability_dimension": "social",
    "verbatim_quote": "Kadar penyertaan tenaga buruh 0.64% (2015) Sasaran 0.75% (2030)",
    "confidence": "high"
  },
  {
    "source_doc": "Johor_master_plan.pdf",
    "source_page": 208,
    "state": "JOH",
    "commitment_type": "other",
    "target_value": 2.0,
    "target_unit": "hectares per 1000 urban population",
    "target_year": 2030,
    "baseline_value": 1.69,
    "baseline_year": 2015,
    "sustainability_dimension": "environmental",
    "verbatim_quote": "Keluasan kawasan lapang bagi setiap 1,000 orang penduduk bandar 1.69 (2015) Sasaran 2.00 (2030)",
    "confidence": "high"
  },
  {
    "source_doc": "Johor_master_plan.pdf",
    "source_page": 173,
    "state": "JOH",
    "commitment_type": "other",
    "target_value": 0,
    "target_unit": "percent industrial land outside zones",
    "target_year": 2030,
    "baseline_value": 11.9,
    "baseline_year": 2015,
    "sustainability_dimension": "environmental",
    "verbatim_quote": "Guna tanah industri di luar zon industri 11.9% (2015) Sasaran 0% (2030)",
    "confidence": "high"
  },
  {
    "source_doc": "Johor_master_plan.pdf",
    "source_page": 224,
    "state": "JOH",
    "commitment_type": "other",
    "target_value": 100,
    "target_unit": "percent 4G coverage",
    "target_year": 2030,
    "baseline_value": 40,
    "baseline_year": 2015,
    "sustainability_dimension": "economic",
    "verbatim_quote": "Peratusan liputan rangkaian 4G di bandar-bandar dan petempatan utama 40% (2015) Sasaran 100% (2030)",
    "confidence": "high"
  }
]
