[
  {
    "source_doc": "Sarawak_master_plan.pdf",
    "source_page": 20,
    "state": "SWK",
    "commitment_type": "other",
    "target_value": 282,
    "target_unit": "RM billion GDP",
    "target_year": 2030,
    "baseline_value": 136,
    "baseline_year": 2019,
    "sustainability_dimension": "economic",
    "verbatim_quote": "double the size of our economy from RM136 billion in 2019 to RM282 billion in 2030",
    "confidence": "high"
  },
  {
    "source_doc": "Sarawak_master_plan.pdf",
    "source_page": 20,
    "state": "SWK",
    "commitment_type": "other",
    "target_value": 8.0,
    "target_unit": "percent GDP growth per annum",
    "target_year": 2030,
    "baseline_value": null,
    "baseline_year": null,
    "sustainability_dimension": "economic",
    "verbatim_quote": "Sarawak economy needs to grow on average 8.0% per annum until 2030",
    "confidence": "high"
  },
  {
    "source_doc": "Sarawak_master_plan.pdf",
    "source_page": 30,
    "state": "SWK",
    "commitment_type": "tourism_receipts",
    "target_value": 11,
    "target_unit": "percent of GDP",
    "target_year": 2030,
    "baseline_value": null,
    "baseline_year": null,
    "sustainability_dimension": "economic",
    "verbatim_quote": "Higher GDP contribution - accounting for 11% by 2030",
    "confidence": "high"
  },
  {
    "source_doc": "Sarawak_master_plan.pdf",
    "source_page": 30,
    "state": "SWK",
    "commitment_type": "visitor_arrivals",
    "target_value": 7.5,
    "target_unit": "percent annual growth rate",
    "target_year": 2030,
    "baseline_value": null,
    "baseline_year": null,
    "sustainability_dimension": "economic",
    "verbatim_quote": "Increased arrivals - 7.5% annual growth rate in visitor arrivals",
    "confidence": "high"
  },
  {
    "source_doc": "Sarawak_master_plan.pdf",
    "source_page": 30,
    "state": "SWK",
    "commitment_type": "other",
    "target_value": 7.5,
    "target_unit": "nights average length of stay",
    "target_year": 2030,
    "baseline_value": 5.5,
    "baseline_year": null,
    "sustainability_dimension": "economic",
    "verbatim_quote": "increased length of stay from 5.5 nights to 7.5 nights",
    "confidence": "high"
  },
  {
    "source_doc": "Sarawak_master_plan.pdf",
    "source_page": 30,
    "state": "SWK",
    "commitment_type": "employment",
    "target_value": 25,
    "target_unit": "percent of total employment",
    "target_year": 2030,
    "baseline_value": null,
    "baseline_year": null,
    "sustainability_dimension": "social",
    "verbatim_quote": "Employment generation - 25% of total employment in the tourism & hospitality sector",
    "confidence": "high"
  },
  {
    "source_doc": "Sarawak_master_plan.pdf",
    "source_page": 32,
    "state": "SWK",
    "commitment_type": "other",
    "target_value": 8,
    "target_unit": "RM billion annual export value",
    "target_year": 2030,
    "baseline_value": null,
    "baseline_year": null,
    "sustainability_dimension": "economic",
    "verbatim_quote": "Annual export value of RM8 billion by 2030",
    "confidence": "high"
  },
  {
    "source_doc": "Sarawak_master_plan.pdf",
    "source_page": 32,
    "state": "SWK",
    "commitment_type": "other",
    "target_value": 50,
    "target_unit": "community-based ecotourism TPAs",
    "target_year": 2030,
    "baseline_value": null,
    "baseline_year": null,
    "sustainability_dimension": "environmental",
    "verbatim_quote": "50 community-based ecotourism and conservation Totally Protected Areas",
    "confidence": "medium"
  },
  {
    "source_doc": "Sarawak_master_plan.pdf",
    "source_page": 32,
    "state": "SWK",
    "commitment_type": "other",
    "target_value": 4.5,
    "target_unit": "million hectares certified forest",
    "target_year": 2030,
    "baseline_value": null,
    "baseline_year": null,
    "sustainability_dimension": "environmental",
    "verbatim_quote": "Certify 4.5 mil ha of long term forest licence area under Malaysian Timber Certification Council",
    "confidence": "high"
  }
]
