[
  {
    "source_doc": "Kuala_Lumpur_master_plan.pdf",
    "source_page": 69,
    "state": "KUL",
    "commitment_type": "visitor_arrivals",
    "target_value": 22.5,
    "target_unit": "million domestic tourists",
    "target_year": 2040,
    "baseline_value": null,
    "baseline_year": null,
    "sustainability_dimension": "economic",
    "verbatim_quote": "Tourist arrival (million people) Domestic 22.5",
    "confidence": "high"
  },
  {
    "source_doc": "Kuala_Lumpur_master_plan.pdf",
    "source_page": 69,
    "state": "KUL",
    "commitment_type": "visitor_arrivals",
    "target_value": 13,
    "target_unit": "million international tourists",
    "target_year": 2040,
    "baseline_value": null,
    "baseline_year": null,
    "sustainability_dimension": "economic",
    "verbatim_quote": "Tourist arrival (million people) International 13",
    "confidence": "high"
  },
  {
    "source_doc": "Kuala_Lumpur_master_plan.pdf",
    "source_page": 69,
    "state": "KUL",
    "commitment_type": "tourism_receipts",
    "target_value": 77,
    "target_unit": "RM billion total tourist spend",
    "target_year": 2040,
    "baseline_value": null,
    "baseline_year": null,
    "sustainability_dimension": "economic",
    "verbatim_quote": "Total tourist spend (RM billion) 30.4 domestic + 47.0 international",
    "confidence": "high"
  },
  {
    "source_doc": "Kuala_Lumpur_master_plan.pdf",
    "source_page": 63,
    "state": "KUL",
    "commitment_type": "employment",
    "target_value": 1.08,
    "target_unit": "million working population",
    "target_year": 2040,
    "baseline_value": null,
    "baseline_year": null,
    "sustainability_dimension": "social",
    "verbatim_quote": "1.08 MILLION TOTAL WORKING POPULATION",
    "confidence": "high"
  },
  {
    "source_doc": "Kuala_Lumpur_master_plan.pdf",
    "source_page": 63,
    "state": "KUL",
    "commitment_type": "employment",
    "target_value": 75,
    "target_unit": "percent labour participation rate",
    "target_year": 2040,
    "baseline_value": null,
    "baseline_year": null,
    "sustainability_dimension": "social",
    "verbatim_quote": "75% LABOUR PARTICIPATION RATE",
    "confidence": "high"
  },
  {
    "source_doc": "Kuala_Lumpur_master_plan.pdf",
    "source_page": 135,
    "state": "KUL",
    "commitment_type": "other",
    "target_value": 20,
    "target_unit": "square metres open space per person",
    "target_year": 2040,
    "baseline_value": 10.61,
    "baseline_year": 2021,
    "sustainability_dimension": "environmental",
    "verbatim_quote": "20m2 PER PERSON The ratio of open space per person",
    "confidence": "high"
  },
  {
    "source_doc": "Kuala_Lumpur_master_plan.pdf",
    "source_page": 135,
    "state": "KUL",
    "commitment_type": "other",
    "target_value": 50,
    "target_unit": "percent tree canopy coverage",
    "target_year": 2040,
    "baseline_value": null,
    "baseline_year": null,
    "sustainability_dimension": "environmental",
    "verbatim_quote": "50% Tree Canopy Coverage",
    "confidence": "high"
  },
  {
    "source_doc": "Kuala_Lumpur_master_plan.pdf",
    "source_page": 135,
    "state": "KUL",
    "commitment_type": "other",
    "target_value": 1000000,
    "target_unit": "trees planted",
    "target_year": 2040,
    "baseline_value": null,
    "baseline_year": null,
    "sustainability_dimension": "environmental",
    "verbatim_quote": "1.0 MILLION TREES Tree planting in parks, residential areas and tourist hotspots",
    "confidence": "high"
  },
  {
    "source_doc": "Kuala_Lumpur_master_plan.pdf",
    "source_page": 135,
    "state": "KUL",
    "commitment_type": "other",
    "target_value": 200,
    "target_unit": "km park connector network",
    "target_year": 2040,
    "baseline_value": null,
    "baseline_year": null,
    "sustainability_dimension": "environmental",
    "verbatim_quote": "200 km Park Connector Network",
    "confidence": "high"
  },
  {
    "source_doc": "Kuala_Lumpur_master_plan.pdf",
    "source_page": 17,
    "state": "KUL",
    "commitment_type": "other",
    "target_value": 45,
    "target_unit": "percent GHG emissions intensity reduction",
    "target_year": 2030,
    "baseline_value": null,
    "baseline_year": 2005,
    "sustainability_dimension": "environmental",
    "verbatim_quote": "Malaysia will reduce the intensity of greenhouse gas emissions from the GDP by 45 percent in 2030",
    "confidence": "high"
  }
]
